{
  "schema_version": "ultrafuzz.modal.public-benchmark-bundle.v5",
  "benchmark": "ultrafuzz-bench",
  "lane": "smoke",
  "model_slug": "gpt-5-6-luna",
  "model": "gpt-5.6-luna",
  "reasoning": "high",
  "judge_model": "gpt-5.6-sol",
  "judge_reasoning": "xhigh",
  "candidate_commit": "aaaaaaaaaaaaaaaaaaaaaaaaaaaaaaaaaaaaaaaa",
  "eval_run_id": "fixture-run-gpt-5-6-luna",
  "lineage": {
    "logical_run_id": "fixture-run",
    "generation": 1,
    "attempt": 1,
    "attempt_id": "attempt-1",
    "config_fingerprint": "1111111111111111111111111111111111111111111111111111111111111111",
    "source_fingerprint": "2222222222222222222222222222222222222222222222222222222222222222",
    "image_fingerprint": "3333333333333333333333333333333333333333333333333333333333333333",
    "model_fingerprint": "4444444444444444444444444444444444444444444444444444444444444444"
  },
  "status": "succeeded",
  "executed_case_count": 1,
  "graded_case_count": 1,
  "created_at": "2026-08-09T00:00:00.000Z",
  "files": [
    {
      "path": "reports/target-1/report.json",
      "size_bytes": 3,
      "sha256": "5555555555555555555555555555555555555555555555555555555555555555",
      "contents_base64": "e30K"
    }
  ],
  "targets": [
    {
      "id": "target-1",
      "repository": "https://github.com/example/benchmark-target",
      "revision": "6666666666666666666666666666666666666666",
      "framework": "foundry",
      "status": "succeeded",
      "executed_case_count": 1,
      "graded_case_count": 1,
      "publication_location": {
        "bundle_path": "public-results.json",
        "report_paths": ["reports/target-1/report.json"]
      }
    }
  ]
}
